,id,author,created,title,content,subreddit,url,num_comments,score,upvote_ratio,comments
0,kzyfwe,tjk911,2021-01-18 16:52:08+00:00,"""Getting into journalism"" post guidelines","Hey folks - if you're looking into getting into journalism, or a specific beat, here are some guidelines that will help you get better responses from our community. 

Try to include:

* The medium you're working in or wish to work in
* The role you're in or looking to move into
* Your experience if applicable
* Your **general** location if you're comfortable with it (country, US region etc)

If anyone else has suggestions for this list - let me know and I'll add it to it.",Journalism,https://www.reddit.com/r/Journalism/comments/kzyfwe/getting_into_journalism_post_guidelines/,120,239,1.0,<praw.models.comment_forest.CommentForest object at 0x17bd2da00>
1,17lg41p,aresef,2023-11-01 16:32:26+00:00,Reminder about our rules (re: Israel/Hamas war),"We understand there are aspects of the war that impact members of the media, and that there is coverage *about* the coverage, and these things are relevant to our subreddit.

That being said, we would like to remind you to keep posts limited to the discussion of the industry and practice of journalism. Please do not post broader coverage of the war, whether you wrote it or not. If you have a strong opinion about the war, the belligerents, their allies or other concerns, this isn't the place for that.

And when discussing journalism news or analysis related to the war, please refrain from political or personal attacks.

Let us know if you have any questions.",Journalism,https://www.reddit.com/r/Journalism/comments/17lg41p/reminder_about_our_rules_re_israelhamas_war/,1,16,0.82,<praw.models.comment_forest.CommentForest object at 0x17be756d0>
2,17p1be4,Indupaul,2023-11-06 12:10:57+00:00,Filipino journalist gunned down live on air,,Journalism,https://www.ucanews.com/news/filipino-journalist-gunned-down-live-on-air/103170,1,6,1.0,<praw.models.comment_forest.CommentForest object at 0x17be75b80>
3,17p8szq,aresef,2023-11-06 18:02:50+00:00,"Gannett’s Taylor Swift Reporter, Revealed: Meet Bryan West, the First Full-Time Swiftie Journalist",,Journalism,https://variety.com/2023/music/news/taylor-swift-reporter-usa-today-gannett-hire-1235781178/,2,2,1.0,<praw.models.comment_forest.CommentForest object at 0x17be75ee0>
4,17p8q0m,AngelaMotorman,2023-11-06 17:59:46+00:00,"With the world on fire, a cowardly, timid news media is a threat to U.S. democracy",,Journalism,https://www.inquirer.com/opinion/commentary/journalism-free-press-gaza-extremism-20231105.html,2,2,1.0,<praw.models.comment_forest.CommentForest object at 0x17be27100>
5,17p3oc7,osintnewsletter,2023-11-06 14:15:35+00:00,Learn how to search for Spaces/audio on Twitter/X by keyword and extract information about those audio sessions,"The 29th issue of The OSINT Newsletter is published!  

⚡️ Learn how to search for Spaces/audio on Twitter/X by keyword and extract information about those audio sessions  

📰 5 OSINT news articles  

🐦 5 OSINT community posts  

🧰 5 OSINT tools  

📘 Preorder the first print edition of The OSINT Newsletter

https://osintnewsletter.com/p/29",Journalism,https://www.reddit.com/r/Journalism/comments/17p3oc7/learn_how_to_search_for_spacesaudio_on_twitterx/,0,3,1.0,<praw.models.comment_forest.CommentForest object at 0x17be274c0>
6,17p7whf,jms1225,2023-11-06 17:24:14+00:00,Calumet City officials ticket Daily Southtown reporter for ‘hampering’ city employees with questions,,Journalism,https://www.chicagotribune.com/news/breaking/ct-calumet-city-tribune-reporter-citations-20231102-ts6ugr2t6vdahap72yw2s7gkoi-story.html,0,1,1.0,<praw.models.comment_forest.CommentForest object at 0x17be27070>
7,17p0ste,fromorphantohighflye,2023-11-06 11:39:03+00:00,Advice for a pitching a WW2 story,"Hello everyone,  
 

I am seeking the collective advice of this subreddit. 

I was the bestfriend and carer of a WW2 RAF bomber pilot. I knew him for 16 years and was his carer for 3 (he had no family, though the mystery surronding his biological family was solved in 2021). 

After he almost died in 2018, I managed to convince him to let me help him record his incredible life story. He was an orphan who was beaten by his first foster father, had little self-confidence or self-esteem during his childhood, yet had his life changed during WW2. He travelled through Africa, the Middle East and the Far East with the RAF before captaining B-24 Liberators with 159 Squadron against Japanese forces in Burma, Malaya and Thailand at the age of 20. 

In total, he had an almost 15-year RAF career. His life story is incredible, and he changed my life completely. He was the greatest man I have ever met. 

Our book has gone on to sell very well, both in Britain and abroad. 

Now, I wish to pitch this story to relevant media outlets here in the UK. Denis's life story, and our friendship, have resonated with thousands around the world. Does anyone have any advice on how to pitch our story, what to focus on, how to make the approach, anything to keep in mind, dos and don'ts? (Note, we have already received coverage in the *Daily Express* and some regional newspapers. I don't know if that would help or hinder?) 

I have attached a photo of me and Denis and a link for our website if they are of any help: [www.fromorphantohighflyer.com](https://www.fromorphantohighflyer.com)

&#x200B;

Thank you,

&#x200B;

Philip

https://preview.redd.it/ljq8y1bzrpyb1.jpg?width=1200&format=pjpg&auto=webp&s=0f590ae6bd3355bd3312e05754a793693241c6f8",Journalism,https://www.reddit.com/r/Journalism/comments/17p0ste/advice_for_a_pitching_a_ww2_story/,1,2,1.0,<praw.models.comment_forest.CommentForest object at 0x17be27640>
8,17oo6x9,BelleStar30,2023-11-05 22:55:24+00:00,Upwork?,Has anyone used upwork to freelance? What are the pros and cons ?,Journalism,https://www.reddit.com/r/Journalism/comments/17oo6x9/upwork/,4,9,1.0,<praw.models.comment_forest.CommentForest object at 0x17be27880>
9,17oft4s,Benjazzi,2023-11-05 16:39:03+00:00,French journalist Tristan Waleckx receives death threats at home after airing documentary about Hamas,,Journalism,https://www.ouest-france.fr/societe/justice/le-presentateur-de-complement-denquete-menace-de-mort-apres-lemission-sur-le-hamas-a5545c14-7a30-11ee-a596-470e505b11c6,1,9,0.92,<praw.models.comment_forest.CommentForest object at 0x17be27fa0>
10,17ns533,Alan_Stamm,2023-11-04 18:39:26+00:00,New York Times Writer Resigns After Signing Letter Protesting the Israel-Gaza War,,Journalism,https://www.nytimes.com/2023/11/03/business/media/new-york-times-writer-resign-israel-gaza-war.html,633,484,0.9,<praw.models.comment_forest.CommentForest object at 0x17be785b0>
11,17oi8xb,Aljameel1,2023-11-05 18:30:24+00:00,Recently 46 Journalists were murdered by Israel in Gaza. Others lost their families intentaly,,Journalism,https://i.redd.it/wlypcotnokyb1.jpg,7,6,0.65,<praw.models.comment_forest.CommentForest object at 0x17be78220>
12,17optwh,LectorLoco,2023-11-06 00:10:27+00:00,How many stories does a journalist write on average in a day?,"I know it's multifactorial, but I'd like to hear the community's opinion. I'm studying journalism, and this question came to mind today. I wanted to start practicing to improve my writing and research skills, as well as my speed. So, I thought about doing daily drills to get used to it.

I understand it's a team effort and depends on the media and the week, but I believe there could be a consensus on the average. If not, well... How many could I write per day to improve and adapt quickly to any medium? I'd like to excel and be productive in this aspect.",Journalism,https://www.reddit.com/r/Journalism/comments/17optwh/how_many_stories_does_a_journalist_write_on/,9,1,1.0,<praw.models.comment_forest.CommentForest object at 0x17c01ab20>
13,17onkuz,Taylor-Griff,2023-11-05 22:27:40+00:00,Tips for sharing old bylines to a new position,"Hello friends,

I'm still an early-career journalist and am wondering how I can best share an old article I wrote with a new hiring staff. I'm now a position removed from the publication I'm hoping to share from and don't have a subscription there any longer — and neither will the hiring manager. Is there best-practice way to get past an article paywall in this scenario? Appreciate any ideas.

Thank you!",Journalism,https://www.reddit.com/r/Journalism/comments/17onkuz/tips_for_sharing_old_bylines_to_a_new_position/,1,1,1.0,<praw.models.comment_forest.CommentForest object at 0x17bf89640>
14,17ocbf1,BelleStar30,2023-11-05 13:48:13+00:00,What city are you writing or reporting from ?,I would love to relocate after I graduate . I’m currently in Georgia and either want to go to Virginia or maybe Florida . In a perfect world I would work in NYC but I’m sure with the pay it would be almost impossible to make a living . Any advice?,Journalism,https://www.reddit.com/r/Journalism/comments/17ocbf1/what_city_are_you_writing_or_reporting_from/,21,3,0.8,<praw.models.comment_forest.CommentForest object at 0x17bf89b20>
15,17odw7k,Pomond,2023-11-05 15:08:53+00:00,Pooled Fund for Chicago Journalism Becomes Reality,,Journalism,https://mckinleypark.news/about/announcements/4753-pooled-fund-for-chicago-journalism-becomes-reality,0,2,1.0,<praw.models.comment_forest.CommentForest object at 0x17bfa9640>
16,17o3qxa,silence7,2023-11-05 03:54:40+00:00,"William Lewis named publisher and CEO of The Washington Post | The veteran media executive, previously the publisher of the Wall Street Journal, was tapped by Washington Post owner Jeff Bezos to replace Fred Ryan, who stepped down in August.",,Journalism,https://www.washingtonpost.com/style/media/2023/11/04/william-lewis-publisher-ceo-washington-post/?pwapi_token=eyJ0eXAiOiJKV1QiLCJhbGciOiJIUzI1NiJ9.eyJyZWFzb24iOiJnaWZ0IiwibmJmIjoxNjk5MDcwNDAwLCJpc3MiOiJzdWJzY3JpcHRpb25zIiwiZXhwIjoxNzAwNDU2Mzk5LCJpYXQiOjE2OTkwNzA0MDAsImp0aSI6IjUxNmM3NDE2LTljMmMtNDM2Mi1iMTdlLWUyY2IxZmVmZmRmZSIsInVybCI6Imh0dHBzOi8vd3d3Lndhc2hpbmd0b25wb3N0LmNvbS9zdHlsZS9tZWRpYS8yMDIzLzExLzA0L3dpbGxpYW0tbGV3aXMtcHVibGlzaGVyLWNlby13YXNoaW5ndG9uLXBvc3QvIn0.peJotz_hg9aVO37IxvXh4WPiF27h9dEMEscULamzqS8,0,3,0.8,<praw.models.comment_forest.CommentForest object at 0x17bfa9c10>
17,17o87ik,Fun_Cauliflower_7672,2023-11-05 09:20:40+00:00,Is it possible to pitch a data-based article - and where?,"Hi! 

&#x200B;

I wrote a data article for school, with graphs and maps. I'm very happy with the results and would love to pitch it - butI have absolutely no idea where. Are there any data team / newsrooms, in Europe or in the US (the article has an international angle and I believe it can be adapted to pretty much anywhere), that take freelancer work for data articles? 

&#x200B;

Thanks! ",Journalism,https://www.reddit.com/r/Journalism/comments/17o87ik/is_it_possible_to_pitch_a_databased_article_and/,1,1,1.0,<praw.models.comment_forest.CommentForest object at 0x17bfa9be0>
18,17nzj2p,daibhidhscot,2023-11-05 00:12:12+00:00,GB News Guest Michael Crick Kicked During Live Debate On Censorship After He Criticised Network’s Right-Wing,,Journalism,https://www.mediaite.com/uk/gb-news-guest-michael-crick-kicked-during-live-debate-on-censorship-after-he-criticised-the-networks-right-wing-leaning/,2,3,1.0,<praw.models.comment_forest.CommentForest object at 0x17bfa9e50>
19,17o5q6h,DollarStoreTour,2023-11-05 06:07:31+00:00,Maybe I found my calling?.....,"Hey everybody, so glad I found this section of reddit!!!  I don't consider myself someone who watches ""the news"" BUT I love watching stories about food/music/small business/art/etc on YouTube channels like VICE, Thrillist, Eater/Great Big Story and places like that.

&#x200B;

&#x200B;

I'm 33, work a retail job that gives me security/stability, but I was wondering if there's a world out there where I can sell video stories to those outlets I mentioned earlier???....

&#x200B;

I have some college, but my main ""skills"" are things like creating content, video editing, talking to the camera, interviewing, voiceover, writing stuff that's non-fiction but kinda funny/witty, etc.  I don't get paid for these skills, but I do make videos on YouTube that my friends, family and co-workers seem to like watching.....

&#x200B;

And if I ever need something that I can't do myself, I'm usually pretty good at working with freelancers online to 'get things done'.

&#x200B;

I'm just wondering, if MAYBE I can get a freelance job making stuff with/for some of the outlets I actually watch videos by....

&#x200B;

Is this possible?.....Or  I daydreaming?...

&#x200B;

Thanks:",Journalism,https://www.reddit.com/r/Journalism/comments/17o5q6h/maybe_i_found_my_calling/,1,1,1.0,<praw.models.comment_forest.CommentForest object at 0x17bfa9ee0>
20,17oko2n,ERosenwald,2023-11-05 20:17:45+00:00,Karen journo demands you hire them,,Journalism,https://i.redd.it/1zo0btez7lyb1.jpg,53,0,0.33,<praw.models.comment_forest.CommentForest object at 0x17bf5e250>
21,17ntwg3,JonasGrene,2023-11-04 19:55:59+00:00,Should I prioritize programming in job applications?,"I’m relatively fresh out of university with a BA in TV and documentary directing. I’m attempting to land a job in local journalism, in order to maybe have a shot at a career in digital and audiovisual investigative reporting later.

I’ve previously done three years of vocational training in computer technology and electronics while I was in upper secondary school. Because of that I’m comfortable with programming in Python, SQL and front-end languages, having developed portifolio and ecommerce websites from scratch and created an interactive feature article just this fall.

I was curious how valuable skills in programming would be considered in the news media, and if it’s worth spending a few lines in my job applications on this experience? I believe it can be valuable in both data journalism, digital presentation of journalism and covering topics related to technology. There’s actually a relatively substantial IT industry in my region as well.

I’m especially considering diversifying my application because my experience in writing is limited compared to those who’ve studied journalism, and local newspapers in my area don’t do a lot of video.",Journalism,https://www.reddit.com/r/Journalism/comments/17ntwg3/should_i_prioritize_programming_in_job/,4,2,0.75,<praw.models.comment_forest.CommentForest object at 0x17bee6850>
22,17nyve3,Darnett1334,2023-11-04 23:40:35+00:00,Can i use album covers in my school’s online newspaper?,I’m writing an article about the highest selling albums of this past month and was hopping to use lower quality photos of the album covers so the readers can identify the album. Would this be considered fair use?,Journalism,https://www.reddit.com/r/Journalism/comments/17nyve3/can_i_use_album_covers_in_my_schools_online/,1,1,1.0,<praw.models.comment_forest.CommentForest object at 0x17bee4340>
23,17ni6e1,Jariiari7,2023-11-04 09:42:53+00:00,Reporting from Exile: Five journalists forced out of their home countries reflect on how displacement has affected their work — The Dial,,Journalism,https://www.thedial.world/issue-9/journalist-violence-intimidation-exile,0,3,1.0,<praw.models.comment_forest.CommentForest object at 0x17bee46d0>
24,17n6npm,rabiesgrl,2023-11-03 22:16:57+00:00,"If you had freedom to write about whatever you wanted and it would get published, what would it be?","Hi. I am making a news paper for a school assignment and i need some ideas. So far i have written two articles for it, one about the rise of nihilism amongst gen z, and another about the use of the MCU as military and nationalist propaganda by post 9/11 America, that i’m quite proud about. If you had the liberty to write about anything, what would it be about?",Journalism,https://www.reddit.com/r/Journalism/comments/17n6npm/if_you_had_freedom_to_write_about_whatever_you/,22,24,1.0,<praw.models.comment_forest.CommentForest object at 0x17bee4820>
25,17n559m,MikeTheTv666,2023-11-03 21:08:35+00:00,What to do when a source threatens you.,"If a source has made a threat against me or contributed to the harm of another person, am I still under obligation to protect that source or guarantee anonymity? 

Long story short, after conducting a interview in J school, the source sent me threatening messages and concerns about the interview. years later, they have threatened me for a issue unrelated to the article, but still threatened me.

If I am at risk of harm, am I still under obligation to protect my source?",Journalism,https://www.reddit.com/r/Journalism/comments/17n559m/what_to_do_when_a_source_threatens_you/,24,13,0.85,<praw.models.comment_forest.CommentForest object at 0x17c027460>
26,17mzjw3,Alan_Stamm,2023-11-03 16:53:56+00:00,Can reporters make bets on sports they cover? We asked a dozen newsrooms,,Journalism,https://www.niemanlab.org/2023/11/can-reporters-make-bets-on-sports-they-cover-we-asked-a-dozen-newsrooms/,10,12,0.93,<praw.models.comment_forest.CommentForest object at 0x17c0365b0>
27,17n48mp,iJuanAyala,2023-11-03 20:28:32+00:00,Audio readings of new articles: crucial or just helpful?`,"I notice a lot of news sites have an audio file at the top of an article of someone, sometimes the journalist and sometimes not, reading the news article aloud and was wondering if you think this is just helpful or absolutely necessary? Is it something that drives readers to absorb the content more as some can't always read on the go but can certainly listen? Would love to know your thoughts. Thanks!",Journalism,https://www.reddit.com/r/Journalism/comments/17n48mp/audio_readings_of_new_articles_crucial_or_just/,3,5,1.0,<praw.models.comment_forest.CommentForest object at 0x17c03d490>
28,17mh2bb,nookpimp,2023-11-02 23:30:14+00:00,How do you approach interviews?,"College student here, 

As always, no interview is ever the same. But something I struggle with is whether I should just ""wing it"" when talking to a source or if I should go in with a set of questions. Some people tell me to just treat it like a conversation while other people to be ready to go in with questions. What are some tips to feel less awkward or unsure about what to say during an interview? ",Journalism,https://www.reddit.com/r/Journalism/comments/17mh2bb/how_do_you_approach_interviews/,25,20,0.95,<praw.models.comment_forest.CommentForest object at 0x17c03dbe0>
29,17nalo0,here2learn_me,2023-11-04 01:25:32+00:00,"A former lawyer, now in Tech, wanting to get into hard hitting news","Maybe some of you will call me naive. Some may call me arrogant. But I've been a long-time consumer of news, and I think it's in a dismal state. 

I don't want to just blame the news media institutions because at the end of the day, we, the audience, should also bear the responsibility for eating what we're fed (so, to speak). 

Whatever the case, I would like to get into this industry. I have some ideas about what we can do to change how news is covered. 

It's ok if I enter in a small way. I can enter and then build on it. I've been taking some journalism courses on Coursera and Udemy. 

If any of you reporters have any suggestions, I'd appreciate it. Thank you very much. Best. ",Journalism,https://www.reddit.com/r/Journalism/comments/17nalo0/a_former_lawyer_now_in_tech_wanting_to_get_into/,36,0,0.24,<praw.models.comment_forest.CommentForest object at 0x17c04cc70>
30,17m9424,silence7,2023-11-02 17:42:36+00:00,How Microsoft is making a mess of the news after replacing staff with AI,,Journalism,https://www.cnn.com/2023/11/02/tech/microsoft-ai-news/index.html,6,28,0.95,<praw.models.comment_forest.CommentForest object at 0x17c05cf10>
31,17mh8a9,Alan_Stamm,2023-11-02 23:37:59+00:00,Calumet City [Ill.] officials ticket reporter for asking questions,,Journalism,https://www.chicagotribune.com/news/breaking/ct-calumet-city-tribune-reporter-citations-20231102-ts6ugr2t6vdahap72yw2s7gkoi-story.html,2,7,0.9,<praw.models.comment_forest.CommentForest object at 0x17c05da90>
32,17mkrie,dect60,2023-11-03 02:28:53+00:00,CBC president defends broadcaster's Israel-Hamas coverage in a testy meeting with MPs,,Journalism,https://www.cbc.ca/news/politics/cbc-president-tait-defends-coverage-israel-hamas-1.7016274,2,5,1.0,<praw.models.comment_forest.CommentForest object at 0x17c05da00>
33,17mijrk,regulargirl1,2023-11-03 00:39:52+00:00,Prepping for Bloomberg News Test,"Any tips on prepping for the Bloomberg news test?

Obviously, no substitute for good working knowledge of financial markets. But wondering if anyone can offer further guidance.

Thanks in advance!",Journalism,https://www.reddit.com/r/Journalism/comments/17mijrk/prepping_for_bloomberg_news_test/,5,5,1.0,<praw.models.comment_forest.CommentForest object at 0x17c065130>
34,17mj0d4,greenielove,2023-11-03 01:02:02+00:00,The difficulties of reporting on Gaza from the outside – DW,,Journalism,https://www.dw.com/en/the-difficulties-of-reporting-on-gaza-from-the-outside/video-67289558,0,4,1.0,<praw.models.comment_forest.CommentForest object at 0x17c065940>
35,17m6hzz,AngelaMotorman,2023-11-02 15:48:12+00:00,“Fact-checking” fact checkers: A data-driven approach | HKS Misinformation Review,,Journalism,https://misinforeview.hks.harvard.edu/article/fact-checking-fact-checkers-a-data-driven-approach/,0,4,0.84,<praw.models.comment_forest.CommentForest object at 0x17c065a00>
36,17lk5mn,CWang,2023-11-01 19:30:58+00:00,Do We Really Need a Taylor Swift Reporter? | Outlets like USA Today are hiring beat reporters to write exclusively about Swift and Beyoncé. But investing in this kind of journalism distracts from stories people actually need,,Journalism,https://thewalrus.ca/taylor-swift-reporter/?utm_source=reddit&utm_medium=referral,19,86,0.94,<praw.models.comment_forest.CommentForest object at 0x17c065df0>
37,17mg8rr,DetroitsNotThatBad,2023-11-02 22:52:18+00:00,What is the best side hustle in all of journalism?,"Before you ask for details, I left them out on purpose.

Edit: you all suck ",Journalism,https://www.reddit.com/r/Journalism/comments/17mg8rr/what_is_the_best_side_hustle_in_all_of_journalism/,17,0,0.38,<praw.models.comment_forest.CommentForest object at 0x17c077460>
38,17lu8bq,CharmingProblem,2023-11-02 03:12:51+00:00,Why are journalists losing their jobs in record numbers? Blame the Trump slump,,Journalism,https://www.niemanlab.org/2023/11/why-are-journalists-are-losing-their-jobs-in-record-numbers-blame-the-trump-slump/,6,18,0.91,<praw.models.comment_forest.CommentForest object at 0x17c081be0>
39,17lrr3w,shinbreaker,2023-11-02 01:10:59+00:00,"Aside from the legacy outlets (NYT, WaPo, WSJ), what subscriptions are you paying for?",Looking to subscribe to a couple more places but wondered where other reporters are subscribing to. I figured I should just send some money to local reporters even if I don't read much of their news.,Journalism,https://www.reddit.com/r/Journalism/comments/17lrr3w/aside_from_the_legacy_outlets_nyt_wapo_wsj_what/,55,19,0.95,<praw.models.comment_forest.CommentForest object at 0x17c082340>
40,17ltpzc,Incognitotreestump22,2023-11-02 02:46:40+00:00,PSA: Never use your personal number for cold calls to organizations.,"I called all local healthcare providers and left civil, professional messages inquiring about issues with the city's health insurance broker that were resulting in claims not being paid for city employees. This was with a work phone. However, on our website and my business cards, my personal number is visible. I was recently told by a friend who works in health insurance with local providers that it's highly likely they blacklisted all my contact information as a solicitor. With this, I was denied incredibly urgent mental health care and physical checkups as I left call after call for months, trying to fit an appointment into my busy schedule.",Journalism,https://www.reddit.com/r/Journalism/comments/17ltpzc/psa_never_use_your_personal_number_for_cold_calls/,2,8,0.83,<praw.models.comment_forest.CommentForest object at 0x17c0a5eb0>
41,17lq3r6,DoremusJessup,2023-11-01 23:55:02+00:00,"Newspaper publisher, reporter arrested for leaking grand jury information",,Journalism,https://lawandcrime.com/crime/newspaper-publisher-reporter-arrested-for-leaking-grand-jury-information-cops/,2,5,0.86,<praw.models.comment_forest.CommentForest object at 0x17c0a7280>
