,id,author,created,title,content,subreddit,url,num_comments,score,upvote_ratio,comments
124,17gkj1j,backcatbrew,2023-10-26 01:06:29+00:00,Advice for when you're overwhelmed with material,"Hi!! I'm a undergrad student working for a major publication doing an independently led project focusing on voices in an extremely niche arts community. It's not my first journalistic project or publication, but I find myself more overwhelmed here than I have been previously EVER. I have so much interview content I want to use, and each of these individuals (artists) I've interviewed have such rich practices, traditions, and voices. They could all be the subject of a standalone article! Do any of you have any advice for cutting down content and making these voices more unified and digestible without creating a long, behemoth of a draft and without doing their work an injustice? How should I approach this? Any input would be helpful! Thank you!",Journalism,https://www.reddit.com/r/Journalism/comments/17gkj1j/advice_for_when_youre_overwhelmed_with_material/,7,3,1.0,<praw.models.comment_forest.CommentForest object at 0x17c369490>
125,17gjxw9,dinoflameboy,2023-10-26 00:36:34+00:00,Last semester senior looking for job,"Hello! 
I am graduating this semester and I am looking for a job, paid internship, or a fellowship in journalism. I am hoping to get something in Arizona, remote, or at least western U.S. I am particularly interested in environmental (I would really like to work for a vegan magazine), multimedia, data, and arts/life. I am open to other things too though. 

I have had to work throughout college so I don’t have a crazy amount to put on my resume, but this is what I have: 

I did a semester long multimedia internship at my cities main local news outlet. 

I work at a cafe and also as a marketing assistant at my school’s book publisher. 

I took a data journalism class, so I know how to analyze data and make public record requests. 

I also have a 4.0 if that helps

I have been looking on LinkedIn, JournalismJobs.com, and Handshake, but if there is some other opportunities that aren’t as  easily found please let me know. Thank you in advance.",Journalism,https://www.reddit.com/r/Journalism/comments/17gjxw9/last_semester_senior_looking_for_job/,5,3,0.72,<praw.models.comment_forest.CommentForest object at 0x17c369d30>
126,17gcib8,Bum_Fuzzle,2023-10-25 19:11:20+00:00,"Education reporting: K-12 and university admins keep trying to force my interview requests through one person, which makes it way harder for me to access folks. How do I respond to this?","Half the time when I try to interview teachers, professors or administrators, I'm directed straight to the main media liaison without a response from who I need to speak with. I'm a young reporter, but I've already gotten used to this happening. 

I know this is a PR strategy so they can anticipate the news cycle, but I can't afford to waste my time waiting for one person to approve and coordinate multiple interview requests on a deadline. 

These PR folks are important contacts for me and I often contact them directly if I don't already know which source I need, so I need to have a good relationship with them. What can I say to them to help them understand why this is a problem without losing their respect? Personally, I feel like funneling media requests through one person inhibits quality, candid journalism from happening.  

Advice from my editors was just to continue doing what I'm doing and expect the PR folks to yell at me when I don't go through them.",Journalism,https://www.reddit.com/r/Journalism/comments/17gcib8/education_reporting_k12_and_university_admins/,8,7,0.89,<praw.models.comment_forest.CommentForest object at 0x17c36b550>
127,17gm615,OkZookeepergame6841,2023-10-26 02:30:09+00:00,How to do reporting on Facebook?,"Hi everyone,
I am a first year journalism student and struggling to contact human sources over a medium other than email. Does anyone have advice for journalism practices over social media platforms like Facebook? 

I’m writing a local news story for an assignment and found a Facebook post related to my topic that has a lot of comments under it highlighting potential issues/angles for my story that I want to look into - except all of these have been written by normal Facebook users who’ve taken the short time to write their opinions. Is it appropriate to contact these people for an interview? It feels intrusive to direct message a stranger and ask them to elaborate on a comment they wrote under a post, but I really don’t know where else to look. I want to gain some opinions from the locals and this seems like the best method, but I’m not sure what the best practices are in journalism.

If anyone could give my advice about this it would be greatly appreciated! Thank you in advance :)",Journalism,https://www.reddit.com/r/Journalism/comments/17gm615/how_to_do_reporting_on_facebook/,1,1,1.0,<praw.models.comment_forest.CommentForest object at 0x17c36bf10>
128,17g6r7a,publicintegritynews,2023-10-25 14:59:53+00:00,Reporting on environmental justice in your community,"Does everyone in your region have equal access to clean air, water and government enforcement of environmental rules? As a part of our latest investigation, we created a guide on how you can report on environmental justice in your community. [https://publicintegrity.org/environment/pollution/environmental-justice-denied/report-on-environmental-justice-title-vi-complaint/](https://publicintegrity.org/environment/pollution/environmental-justice-denied/report-on-environmental-justice-title-vi-complaint/) ",Journalism,https://www.reddit.com/r/Journalism/comments/17g6r7a/reporting_on_environmental_justice_in_your/,1,5,1.0,<praw.models.comment_forest.CommentForest object at 0x17c3895e0>
129,17fttaf,Positive-Echidna-636,2023-10-25 01:57:49+00:00,I haven’t been proud of my work in awhile,"Probably one of my favorite thing about my sports writer job is the gratification I get when I write a good story. I haven’t had that in awhile. I’m only 17 months out of j-school, and through most of that, I felt myself improving, and often felt like I was outdoing myself. But for the last few months, my stories just feel kind of meh. They’re still OK and still better than stories I wrote maybe a year ago but I haven’t impressed myself in a minute. Has anyone else had something similar happen to them? How did you get out of this funk?",Journalism,https://www.reddit.com/r/Journalism/comments/17fttaf/i_havent_been_proud_of_my_work_in_awhile/,7,14,1.0,<praw.models.comment_forest.CommentForest object at 0x17c3894f0>
130,17g4g4r,button_24,2023-10-25 13:11:27+00:00,College essay,"I have to write a rhetorical analysis about an opinion that both the New York Times talks about as well as Wall Street Journal talk about. Im trying to find something that is not politically driven. Any ideas would be helpful, thank you.",Journalism,https://www.reddit.com/r/Journalism/comments/17g4g4r/college_essay/,6,0,0.5,<praw.models.comment_forest.CommentForest object at 0x17c389f40>
131,17g1329,QuadrilleQuadtriceps,2023-10-25 09:47:55+00:00,"Trans journalists of Reddit, how do you feel about the harassment you've possibly received?","Today in ajournalism class we touched upon an study concerning the harassment male and female journalists have received in the industry. However, a point that a friend and I thought about were that non-binary folks or binary trans people weren't included in said study. There was no data regarding them -- on the other hand, I wonder if stealth trans people would even want to bring that aspect of their identity up in a study due to being exposed.  On another, the topic itself holds so much traumatic potential in it that it may be hard for one to open up.  


I thought to myself that it may be harder for trans men to report the harassment they've received due to wanting to live a stealth life and on the other hand having to conform to the gender stereotypes of being strong and macho.

On the other hand, trans women may face both sexual harassment and harassment on their gender. Especially considering that one often has to write abotu controversial or dangerous topics as a journalist, one may be in an even more vulnerable position.  


Any thoughts?",Journalism,https://www.reddit.com/r/Journalism/comments/17g1329/trans_journalists_of_reddit_how_do_you_feel_about/,2,1,0.52,<praw.models.comment_forest.CommentForest object at 0x17c38ea90>
132,17g0die,Callistemon1,2023-10-25 08:53:22+00:00,Where do I go from here?,"Hi folks, 

I've currently been working at a local regional newspaper in Australia for eighteen months. I've really enjoyed the work, but I'm stuck at the moment. I'm away from my family and the dating pool is terrible for someone who's quite intellectual like me. I haven't really made any friends, partly because the demographics skew older up here. So it's getting harder and harder for me to stay. 

I'm looking for new jobs, but jobs in newspapers seem a bit thin on the ground, especially when I haven't been doing it for that long. And this job has been pretty good. I generally run the EGN part of the newspaper, I allocate stories, take photos, I get to choose what I report on and how I report on it. But jobs that require my experience don't seem to be around much. 

So where do I go from here?

There's jobs that want digital journalists, which I take to mean they want multimedia skills, but I've only really done writing and photography. I did a bit of audio in my degree, but that's it. Could I transition into a job that wants radio and video-based content as well?

I don't want to go into a comms job, but to be fair, I'm not really sure what comms people do. Nevertheless, I really feel journalism is the right path for me.",Journalism,https://www.reddit.com/r/Journalism/comments/17g0die/where_do_i_go_from_here/,4,0,0.5,<praw.models.comment_forest.CommentForest object at 0x17c38edf0>
133,17fzsah,JBnews427,2023-10-25 08:08:13+00:00,What entry level 9-5 jobs are can I do while freelancing at the same time?,"Hello, I am currently a student journalist in the Los Angeles area and I was just released from my primary job as a lifeguard. While that job was good for not being too hectic, it would exhaust me by the end of the day and it’s not a job you can do other work while doing. I’m looking for perhaps an office or desk job where I can reach out to sources or plan interviews while I work or perhaps a job that’s worked out for any of you. I appreciate anyone that takes their time to help and hope to engage more with this subreddit.",Journalism,https://www.reddit.com/r/Journalism/comments/17fzsah/what_entry_level_95_jobs_are_can_i_do_while/,3,1,0.6,<praw.models.comment_forest.CommentForest object at 0x17c396490>
134,17feqp0,Public-Application-6,2023-10-24 14:56:17+00:00,Working from home makes me slack off,"And the procrastination is crazy. I do always get my material in and filed on time but more than once I've slept all day during work hours and then stayed up all night to do the work. Almost feels like being back in college where the deadline for the assignment was my only motivator. I feel in part is that because I have little to no oversight at work as long as I get the material in on time, no one cares. It gives me anxiety but not enough to actually do something about it. What are some reccs y'all have for dealing with procrastination?",Journalism,https://www.reddit.com/r/Journalism/comments/17feqp0/working_from_home_makes_me_slack_off/,19,23,0.85,<praw.models.comment_forest.CommentForest object at 0x17c3966a0>
135,17fr2jd,Alan_Stamm,2023-10-24 23:44:19+00:00,NYT Brings in Outside Lawyers to Probe Ex-Bureau Chief's Behavior,,Journalism,https://www.thedailybeast.com/nyt-brings-in-outside-lawyers-to-probe-ex-bureau-chief-jesse-mckinleys-behavior,0,4,1.0,<praw.models.comment_forest.CommentForest object at 0x17c3a5310>
136,17fkfoq,aresef,2023-10-24 19:01:40+00:00,The Messenger Is Speedrunning The Media Startup Life Cycle,,Journalism,https://defector.com/the-messenger-is-speedrunning-the-media-startup-life-cycle,2,8,0.83,<praw.models.comment_forest.CommentForest object at 0x17c3a58e0>
137,17fkmm5,aresef,2023-10-24 19:09:48+00:00,"Governor's comments about FFP reporter infuriating, dead wrong",,Journalism,https://flatwaterfreepress.org/governors-comments-about-ffp-reporter-are-in-a-word-wrong/,0,3,0.8,<praw.models.comment_forest.CommentForest object at 0x17c3a5430>
138,17f4sbl,Fragrant-Policy4182,2023-10-24 04:49:54+00:00,Deep in the weeds of an article: help!,"Any tips for someone who has severely over analyzed a file, probably interviewed too many people, and is 2000 words deep with nothing cohesive.   


I'm trying to simplify, but it sucks to lose what I could forsee as a nuanced article. ",Journalism,https://www.reddit.com/r/Journalism/comments/17f4sbl/deep_in_the_weeds_of_an_article_help/,18,10,0.92,<praw.models.comment_forest.CommentForest object at 0x17c3a57f0>
139,17f2cjz,BelleStar30,2023-10-24 02:36:15+00:00,Are more and more journalists working mostly from home ?,,Journalism,https://www.reddit.com/r/Journalism/comments/17f2cjz/are_more_and_more_journalists_working_mostly_from/,18,15,1.0,<praw.models.comment_forest.CommentForest object at 0x17c396e50>
140,17eu4k8,GazetteGuru,2023-10-23 20:24:38+00:00,"Feed of recent newspaper, magazine, publication shut downs and closures?","Im looking for something like this which you can check for recent newspaper closures, but which is up to date (updated weekly or more), this one they stopped updating in 2016 - [https://newspaperownership.com/whats-new/recent-newspaper-sales/](https://newspaperownership.com/whats-new/recent-newspaper-sales/)

Something like this as well, but more updated - [https://www.theguardian.com/media/newspaper-closures](https://www.theguardian.com/media/newspaper-closures)

Does anyone know a resource for this?  


I use google alerts now for term like 'newspaper shut down' there's a few per week, but it's a lot of work to sift through the google alerts because it picks up false positives about any company shut down, not just newspapers",Journalism,https://www.reddit.com/r/Journalism/comments/17eu4k8/feed_of_recent_newspaper_magazine_publication/,2,52,0.98,<praw.models.comment_forest.CommentForest object at 0x17c3bddc0>
141,17f8c6d,infochimp,2023-10-24 08:59:04+00:00,Any tv journos on here?,I’m hoping for some advice on live crosses in the field .. how to script and more importantly how to remember without relying on notes!,Journalism,https://www.reddit.com/r/Journalism/comments/17f8c6d/any_tv_journos_on_here/,5,2,1.0,<praw.models.comment_forest.CommentForest object at 0x17c3be190>
142,17f04ko,coleslawjourney,2023-10-24 00:48:47+00:00,Dealing with a bad editor?,"Title is fairly self-explanatory. The managing editor at my publication truly makes my job (and the jobs of my fellow reporters) a living hell. This is my first post-grad full-time journalism job, and I’ve been at it for about six months. When I was in J-school and at past internships, I was blessed - spoiled, really - with some fantastic, empathetic editors who also were treasure troves of wisdom and experience. One was a Pulitzer winner, etc. Just super great editors. 

The editor I work under now plays favorites to the max - they (I’m using gender neutral pronouns to protect their identity) oftentimes don’t even edit the stories of one of our reporters who they like, which almost every day leads to that reporter’s stories being published with spelling errors, incorrect information, wrong names, etc., which reflects poorly on ALL of us and reduces our paper’s credibility. The editor in question also tends to be INCREDIBLY moody and just downright mean sometimes. Also is just terrible at, well, managing and editing. Can be downright biased and often edits the teeth out of our stories. Has right-wing beliefs that sometimes seep into our paper. They constantly promise to give us training, help, etc., but never follow through on those promises. They ask for feedback on what we think needs to change in the newsroom, but has never once implemented any of those changes or tried to make improvements.

I again want to emphasize that the biggest problem is that they’re often just downright mean, rude, and critical without being constructive, which just stresses all of us out to the max and leaves us constantly on edge wondering what we’re going to get berated for next. That’s really hard particularly for me as a recent grad - I’m trying so hard to build up my confidence only for it to constantly be shot down by my direct superior. I‘m giving this job EVERYTHING I have, trying so hard to build a solid reputation, and working to deliver important information to the community. It’s just such a shame because I’m in a lovely area of the country, and EVERYONE else in my newsroom are beyond lovely individuals who I’ve grown close with. But I just cannot shake the unending toxicity of my editor. It’s burning me out FAST. And I’m not the only one - our paper has a big problem with staff turnover, and I suspect that the editor plays a big part in that (in addition to all the other typical problems with local news that cause people to leave their jobs). I know I’ve considered quitting multiple times just in the past six months, but I’m stuck in a lease in this city until the spring and I don’t just want to give up.

&#x200B;

Anyways, how have you all dealt with bad editors in your careers? I’m trying to find a balance between sticking up for myself and setting boundaries when they say or do something out of pocket, but I also want to eventually leave this job on good terms with good references. Don’t wanna burn any bridges.

Advice?",Journalism,https://www.reddit.com/r/Journalism/comments/17f04ko/dealing_with_a_bad_editor/,9,8,0.83,<praw.models.comment_forest.CommentForest object at 0x17c3be9d0>
143,17f9vez,457655676,2023-10-24 10:48:26+00:00,How Neil Sheehan Really Got the Pentagon Papers,,Journalism,https://theintercept.com/2023/10/07/pentagon-papers-daniel-ellsberg-neil-sheehan/,1,1,1.0,<praw.models.comment_forest.CommentForest object at 0x17c3c9550>
144,17ev8ek,dect60,2023-10-23 21:10:28+00:00,"Journalists viewing graphic images and videos of Israel-Hamas war take on a heavy, mental toll | CNN Business",,Journalism,https://www.cnn.com/2023/10/19/media/israel-hamas-war-images-trauma/index.html,0,13,0.93,<praw.models.comment_forest.CommentForest object at 0x17c3c9a90>
145,17ex1p2,InvestorMonitor,2023-10-23 22:26:47+00:00,Dealing with anxiety about corrections?!,"Ok I might be crazy, I am not sure if correction anxiety is a thing that others feel or if it just me….

I’ve been a staff reporter for a few years and now I am freelance. I am so careful. I triple check names, titles, company descriptions, quotes, hyperlinks and yet no matter careful I am,  I usually get at least one correction or update request per article. If it’s a big feature, it could be 3-4 requests. 

I feel absolutely awful if i make a genuine mistake, however, most of the time they are only small changes. Sometimes I even think some companies are pedantic about requesting corrections, especially if the article is critical of them.

When I was on staff, dealing with the anxiety of publishing a story and handling the corrections was somewhat manageable as I had easy access to the editor and I knew the editor knew me and understood that I was hard worker who cared deeply about accurate reporting and did good work.

But now I am freelance, the anxiety really eats at me. I am on edge waiting to see what people want fixed for the first 24 hours after the article is published. It sometimes even takes the joy out of publishing a great story. For example, this week I published a feature with perspectives of 14+ sources (not all featured) and waiting to hear from them all on what might need changed makes me so anxious. It’s even worse if I have a story come out on the weekend and I can’t get quick access to the editor to make a fix then its ruining my day off.

I think the anxiety comes from caring about representing things accurately and I am  also worried about having to go back to an editor that I don’t know that well with multiple update requests and whether it will impact with my reputation with them, especially if its a pub I care about.

I am sorry for rambling on about this but I have no idea who to talk to about this. I am not even sure how many correction or update requests journalists typically deal with per story, especially if the stories have more critical angles.

Would appreciate any thoughts or advice.",Journalism,https://www.reddit.com/r/Journalism/comments/17ex1p2/dealing_with_anxiety_about_corrections/,9,8,1.0,<praw.models.comment_forest.CommentForest object at 0x17c3c9610>
146,17ep066,Sonderesque,2023-10-23 16:47:34+00:00,How the Media Got the Hospital Explosion Wrong,,Journalism,https://www.theatlantic.com/ideas/archive/2023/10/gaza-hospital-explosion-misinformation-reporting/675719/,22,16,0.78,<praw.models.comment_forest.CommentForest object at 0x17c3cc880>
147,17f0f2x,dect60,2023-10-24 01:02:45+00:00,'New York Times' backtracks on Gaza hospital blast coverage,,Journalism,https://www.jpost.com/international/article-769779,0,3,0.71,<praw.models.comment_forest.CommentForest object at 0x17c3c9fa0>
148,17eqyaw,News-Flunky,2023-10-23 18:11:07+00:00,When Police Raid A Newspaper for No Reason | An interesting 24 minute summary of the Marion County newspaper raid fiasco from Legal Eagle,,Journalism,https://www.youtube.com/watch?v=-CX1aJRUzPY&t=547s,0,10,1.0,<praw.models.comment_forest.CommentForest object at 0x17c3dfc70>
149,17f2m5x,Melodic-Service-6217,2023-10-24 02:49:54+00:00,Getting a foreign journalist (J2) visa for China,"I’m an Australian planning a reporting trip to China soon and battling through the visa application process. I’m supposed to be going in just over a month but I’m not feeling too hopeful that my visa will be approved in time, if it’s approved at all. 

I’m not super clear on the documents I need to present at the consulate. Website says a letter from the media organisation and a “visa notification letter”. I’m not sure how to obtain the notification letter. Or is that something that gets issued automatically? 

I’ve tried calling the visa centre and consulate but I gave up after sitting on the phone for an hour and a half waiting for someone to pick up. 

Has anyone here ever applied for a J2 China visa? Any tips or advice would be appreciated!",Journalism,https://www.reddit.com/r/Journalism/comments/17f2m5x/getting_a_foreign_journalist_j2_visa_for_china/,1,2,1.0,<praw.models.comment_forest.CommentForest object at 0x17c3dfa60>
150,17epau3,katarinapavlenko,2023-10-23 17:00:24+00:00,Assignment year two journalism students complete the survey please,"Dear all,

We kindly ask you to complete the following survey, which will be used for assignment purposes.

[https://docs.google.com/forms/d/1w51EZlZlTrUiqYA0npCleM7PLGQp6FKtueKu8uL4ohU/edit](https://docs.google.com/forms/d/1w51EZlZlTrUiqYA0npCleM7PLGQp6FKtueKu8uL4ohU/edit)

Kind regards,

Katarina Pavlenko",Journalism,https://www.reddit.com/r/Journalism/comments/17epau3/assignment_year_two_journalism_students_complete/,1,1,1.0,<praw.models.comment_forest.CommentForest object at 0x17c3dfbb0>
151,17dy4u1,willpeetrz,2023-10-22 17:13:06+00:00,Is Al Jazeera English reputable?,"The other day,  the Israeli Defense Forces claimed it killed four Hamas fighters in a gunfight. Oops. Al Jazeera's investigative unit was able to use satellite imagery showing the men were unarmed and executed in cold blood after being ordered to sit on the ground.  [https://www.youtube.com/watch?v=BDb2-UuinaI&ab\_channel=AlJazeeraEnglish](https://www.youtube.com/watch?v=BDb2-UuinaI&ab_channel=AlJazeeraEnglish)

Do professional journos consider Al Jazeera English a credible source on this?  ",Journalism,https://www.reddit.com/r/Journalism/comments/17dy4u1/is_al_jazeera_english_reputable/,50,44,0.81,<praw.models.comment_forest.CommentForest object at 0x17c3df580>
152,17ehqte,Pickled__Pigeon,2023-10-23 11:05:26+00:00,What do you guys think? Any tips?,,Journalism,/r/ElectoralPapers/comments/17ehn4f/001_surprise_success_for_argentine_left_and/,0,0,0.5,<praw.models.comment_forest.CommentForest object at 0x17c404eb0>
153,17ec19z,JenJen71902,2023-10-23 04:21:46+00:00,Tell me your honest pros and cons of going into political journalism/reporting,"Hello, all! I've always been curious about political journalism but haven't yet got the chance to actually try it out. I feel the curiosity to do it for its impact potential and the fact that you're covering some of the most important issues at hand - but the thing about me is that I don't think I've ever had a ""natural"" interest in politics -- meaning, I don't spend my free time catching up on the latest issues in Congress, spend free time reading on foreign affairs, etc. 

Before I even think about investing time and money down this path, please give me the straightforward pros and cons, if you have experience or know of others on this path! It would help me a lot to hear from others on any insights they may have. 

For more info, I'm currently pretty content with where I am on the entertainment/general news path - but you KNOW, the grass seems always greener on the other side...and I'm wondering if covering the most important issues in politics would make me feel like I'm making more impact, etc. It would be a major pivot for sure, so all insight is welcomed!

THANK YOU SO MUCH! 

&#x200B;

&#x200B;",Journalism,https://www.reddit.com/r/Journalism/comments/17ec19z/tell_me_your_honest_pros_and_cons_of_going_into/,9,3,1.0,<praw.models.comment_forest.CommentForest object at 0x17c406160>
