,id,author,created,title,content,subreddit,url,num_comments,score,upvote_ratio,comments
293,17425c6,lluukkee21313,2023-10-09 20:30:05+00:00,"I called out my former editor for plagiarizing my work, now she's threatening to sue me for defamation if I continue talking about it","\[edit: Beverly Press has now added a footnote that says I ""contributed"" to the story in 2018, despite the fact that I reported and wrote most of it. My former editor inexplicably keeps a solo byline even though she only added a few nonsubstantive grafs. Completely whitewashed the act of plagiarism. I stand by my original request, which was for them to \*appropriately\* credit my original work and acknowledge their intial failure to do so, as any responsible news org would do in this situation. But I accept that this is as far as they're going to go.\]

In 2018, while working for the Beverly Press, [I wrote a feature story about the Formosa Cafe](https://beverlypress.com/2018/09/famous-hollywood-cafe-prepares-for-its-second-act/) in West Hollywood as it prepared for its reopening.

Last week, editor/owner Karen Villalpando [published a story about the Formosa Cafe](https://beverlypress.com/2023/09/meet-me-at-the-formosa/). Six and a half out of 11 paragraphs of her story were copied verbatim from my original story, but my work was not credited.

Since Karen was named Print Journalist of the Year by the LA Press Club back in June, I assumed she would want to rectify a blatant act of plagiarism with an editor's note that appropriately credited my original reporting. I sent the email in the screenshot attached.

Instead, she had an attorney send me a [cease and desist email](https://www.documentcloud.org/documents/24004867-letter-to-luke-harold_10323) that threatened a defamation lawsuit if I continue [to post about Karen's plagiarism on Twitter](https://twitter.com/luke_harold/status/1707462347659559011) or communicate with anyone about it. 

I already violated their cease and desist letter with three more tweets (and this reddit post). If they follow through on the lawsuit, I imagine it would be the first time an American media outlet filed a lawsuit in defense of an act of plagiarism. Feels bizarre, ironic and surreal that a newspaper editor would fight so passionately for her legal right to plagiarize a former employee while ignoring the ethical obligation as a journalist to not plagiarize.

Their attorney also appears to conflate copyright infringement with plagiarism. I'm not claiming any ownership of the article. I'm only claiming an ethical breach, given that plagiarism is considered a mortal sin in journalism and virtually all legitimate news outlets have a zero-tolerance policy for it.",Journalism,https://www.reddit.com/r/Journalism/comments/17425c6/i_called_out_my_former_editor_for_plagiarizing_my/,35,38,0.89,<praw.models.comment_forest.CommentForest object at 0x17c76c2e0>
294,174mqgw,chawritestolive,2023-10-10 14:33:02+00:00,"I joined a digital magazine as a feature writer, what's the normal workload like?","Currently doing 2 writeups a day (around 500 words), is that normal?",Journalism,https://www.reddit.com/r/Journalism/comments/174mqgw/i_joined_a_digital_magazine_as_a_feature_writer/,1,1,1.0,<praw.models.comment_forest.CommentForest object at 0x17c7831c0>
295,174549h,Longjumping_Bad9555,2023-10-09 22:33:22+00:00,Jumping from print to tv,"Wish me luck everyone. 

I’m moving from a long career as a print journalist to working behind the scenes in TV news.  A totally new career field, but still within the industry. 

Anything I should know? It’s been 20 years since I’ve done any work in a tv newsroom.",Journalism,https://www.reddit.com/r/Journalism/comments/174549h/jumping_from_print_to_tv/,11,16,1.0,<praw.models.comment_forest.CommentForest object at 0x17c783670>
296,1743mje,MercymainOverwatch,2023-10-09 21:30:43+00:00,‘Terrorists’ or ‘Militants’?,"For coverage of the Hamas attacks should we be using “terrorist” or “millitants” I’ve seen both used, sometimes in one article",Journalism,https://www.reddit.com/r/Journalism/comments/1743mje/terrorists_or_militants/,87,18,0.85,<praw.models.comment_forest.CommentForest object at 0x17c783640>
297,174kbvg,zsreport,2023-10-10 12:48:23+00:00,"Native news service embraces challenges, opportunities of Montana bureau",,Journalism,https://montanafreepress.org/2023/10/09/native-news-service-embraces-challenges-opportunities-of-montana-bureau/,0,1,0.67,<praw.models.comment_forest.CommentForest object at 0x17c7c6580>
298,17495b0,yo-its-bo,2023-10-10 01:35:15+00:00,On the scene reporting,"Hi everyone. For years now, I’ve felt like I had this desire to be an on-the-scene reporter. My family was in a terrorist attack in Barcelona, and since then, I have found myself going towards the story and gathering great tweets, videos and Snapchat stories about what it was I’m seeing. It’s a bit of a joke working my friend group that I’m their reporter. 

After seeing Ukraine & Russia, Israel & Palestine, and the fact that Cidade de Deus is my favorite movie ever, I really want to become an on the scene reporter. 

I’m a great traveler & I host a video show conducting interviews and news reporting within my company so that’s the extent of my journalism experience. 

Does anyone have any tips on where to look for a foot in the door where you physically head into the story and become an eye witness reporter?",Journalism,https://www.reddit.com/r/Journalism/comments/17495b0/on_the_scene_reporting/,14,3,1.0,<praw.models.comment_forest.CommentForest object at 0x17c7c6b50>
299,1744pwr,lilysfever,2023-10-09 22:16:18+00:00,"should i include clips in my resume, or add them as a separate document when applying?","hello all! i put together two versions of my latest journalism resume because i know that most people tend to want to see just a one-page layout, but the stories i want to showcase for the position take up a lot of room and make the design look a little cluttered when formatted together.

is it better to rework the resume and keep everything in one document, or should i submit another pdf with links to and summaries of my articles?

it's not specified for the job listing, but there IS room for other uploads in the online application. tbh i'm just trying to think realistically (from a hiring perspective) about whether people will bother looking at a page of clips after my resume, since i know my experience is not nearly as impressive as my individual articles. thank you!",Journalism,https://www.reddit.com/r/Journalism/comments/1744pwr/should_i_include_clips_in_my_resume_or_add_them/,8,1,1.0,<praw.models.comment_forest.CommentForest object at 0x17c7c9790>
300,173nfrl,she_is_messy,2023-10-09 09:18:14+00:00,Advice for HS Journalist,"Hi! I’m the EIC of my high school’s news publication and our high school has seen a rise in incidents of hate speech among students. The editorial board (myself included) thinks that this reflects larger issues surrounding race relations in our very white and suburban school community. Our admin doesn’t publicly release the exact data on hate speech incidents and for privacy reasons, they can’t tell us the names of victims so we are looking to gather student perspectives. We wanted to host a town hall/open forum where anyone could come in and share their experiences but the reality is, our school population is on the apathetic side and getting people to sacrifice lunch time to attend this kind of event let alone share their experiences would be difficult. Our other idea was making an anonymous Google Form that asks questions about student experiences with bias but from past experiences with Google Forms, it’s difficult to get HS students to answer open ended google forms. 

Does anyone have any ideas for how we can go about starting a dialogue regarding the prevelance of bias in our school community that students would be responsive to? Are there any ways we could incentivize students that don’t involve money? 

Covering this is really important to us since it’s an elephant in the room issue we’ve largely ignored. While we are looking for student perspectives to get the dialogue started, we are also exploring other (possibly more investigative) ways of covering this topic. Any and all suggestions are appreciated.

If this isn’t clear or I haven’t provided enough context, I am happy to explain further. 

Thanks!",Journalism,https://www.reddit.com/r/Journalism/comments/173nfrl/advice_for_hs_journalist/,6,8,0.91,<praw.models.comment_forest.CommentForest object at 0x17c7ca520>
301,173rasc,Journo_22,2023-10-09 13:04:27+00:00,Advice on switching beats,"Hello all,   


I am looking to seek advice about switching beats. So for two years now, I have been covering and writing sports. While I have covered plenty in the last two years, I often feel I must also explore and potentially cover other beats. For example, maybe write about International Affairs or Politics.  Right now, I am 23-years-old and I am also pursuing my Masters Degree in Journalism and Mass Communication. Do you think it would be a good decision to switch beats, or should I continue covering sports? Your advice on this matter would be highly appreciated. Thanks. ",Journalism,https://www.reddit.com/r/Journalism/comments/173rasc/advice_on_switching_beats/,4,4,0.84,<praw.models.comment_forest.CommentForest object at 0x17c7caf40>
302,173zor5,Longjumping-Jelly883,2023-10-09 18:51:01+00:00,Studying journalism in London looking for a summer internship,I am currently studying a very hands on journalism degree that gives me a lot of experience and diverse exposure to different fields. My course covers the NCTJ along with a BA hons. I have been looking for a press office to intern at during the summer if there any employing. Are there any tips or tricks to getting in because there aren’t very many windows and most ‘media’ fields are marketing.,Journalism,https://www.reddit.com/r/Journalism/comments/173zor5/studying_journalism_in_london_looking_for_a/,1,1,1.0,<praw.models.comment_forest.CommentForest object at 0x17c7d4640>
303,173z3bx,mygmjtt,2023-10-09 18:27:08+00:00,Trans journalists: do you put pronouns in your signature?,"I’m hoping to hear from other trans/nonbinary journalists on how y’all handle pronouns in your email signature. 

I’m nonbinary but use she/her and they/them pronouns. I get misgendered a lot over email because I have a vaguely masculine name. 

I’ve considered putting my pronouns in my email signature to prevent it from happening so often, but I’m wondering: should I include they/them? It would immediately out me as nonbinary to anyone I email, and although I cover a pretty progressive community, there’s definitely still conservative folks in the town. I worry that anyone ignorant/transphobic wouldn’t take me seriously or assume I’ll be biased because of my gender identity. 

Has anyone else dealt with this before? Or generally struggling to navigate a profession where you must remain politically neutral, but your identity is seen as a political statement? TIA!",Journalism,https://www.reddit.com/r/Journalism/comments/173z3bx/trans_journalists_do_you_put_pronouns_in_your/,31,0,0.5,<praw.models.comment_forest.CommentForest object at 0x17c850a90>
304,173z3ac,thinkingitthroughrn,2023-10-09 18:27:04+00:00,"Doubts + burnout at a national paper, early career","hey, first time poster here so hope I'm doing everything right re. forum rules

I'd be grateful for some general advice. Not necessarily looking for people to tell me to quit my job immediately, but rather thoughts / encouragement etc.

I'm on a very competitive early-career programme at a national newspaper in Europe \[I won't specify which, but e.g. equivalent to the Washington Post\]. This is my first full-time job, apart from some temporary journalism freelancing as a student / recent graduate etc. 

It's been amazing in many ways, with lots of bylines, opportunities, great newsroom colleagues + connections. Very exciting and I've learned a huge amount. 

However, I feel quite burned-out, tired, and lacking in inspiration. I do my job fine and get good feedback. But inside I feel so anxious, having to represent myself in the intense atmosphere to stressed editors. I also have realised I really don't like general reporting, all the unpredictability and late nights. I feel like my personality type is 'wrong', that I'm not tough & cynical enough. 

Lots of people seem to idealise the pace and intensity of journalism, or long for the nostalgic days of being a cub reporter starting out ... but I'm feeling like I don't want it any more. 

Tl;dr: please help, I'm tired and feel bad about not making the most of my job. 

&#x200B;",Journalism,https://www.reddit.com/r/Journalism/comments/173z3ac/doubts_burnout_at_a_national_paper_early_career/,5,1,1.0,<praw.models.comment_forest.CommentForest object at 0x17c8507c0>
305,173g5gy,MungoJerrysBeard,2023-10-09 01:52:13+00:00,Biggest truth bombs?,"Journalists in the profession - what’s the biggest home truths you learned in the business? For me, I wanted to become a journalist after reading books by foreign correspondents reporting in wars and revolutions and assumed working for a news wire would be that way. An amazing life of adventure. It’s not anymore! The days of just heading to a country and hoping for a decent story are long gone. Working for a wire now involves signing up to local terms (on pay and health benefits), living in near poverty and as for having a family - forget it, a lengthy pitching process where even a budget air ticket is queried, and more often than not, the story has to have an economics angle to interest our paymasters - investors. The basic salary of a wire journalist can be decent but there are no bells and whistles and you spend 90% of your time in a capital city, writing at your desk.",Journalism,https://www.reddit.com/r/Journalism/comments/173g5gy/biggest_truth_bombs/,31,21,0.84,<praw.models.comment_forest.CommentForest object at 0x17c8637f0>
306,173smwd,Aureolater,2023-10-09 14:04:13+00:00,I saw this (BBC?) reporter in a video with diplomat Kishore Mahbubani. What's his name?,,Journalism,https://imgur.com/a/oABQhzJ,0,0,0.4,<praw.models.comment_forest.CommentForest object at 0x17c87b160>
307,173j1vk,DetroitsNotThatBad,2023-10-09 04:27:09+00:00,Controversial: My best work is my procrastinated work (senior J student),It's like I have some sort of wonder drug when I'm in a hurry. ,Journalism,https://www.reddit.com/r/Journalism/comments/173j1vk/controversial_my_best_work_is_my_procrastinated/,8,6,0.87,<praw.models.comment_forest.CommentForest object at 0x17c87b2e0>
308,173kfbn,Material-Landscape28,2023-10-09 05:53:00+00:00,Going live from the street on a budget,"Hi all, this problem has been stressing me out so I hope someone can help me....  


Basically, I need to go live from the street with just an iPhone. The news show would call me from Skype or Zoom. I need a mic to pick up my voice in a possibly noisy location and a headphone that I can hear the host/producer without recording my voice.  


I bought a usb-c splitter for my iPhone (15 pro) and have plugged in a mic and headphones, but that doesn't work. Even when I try to just plug in the mic (have a Rode shotgun mic) it's not working...can iPhones not pick up sound from external mics? 

I was thinking maybe I could use two phones and use both to call into the show....one for listening and one to record myself.  


Any suggestions for a good solution to this issue would be much appreciated!",Journalism,https://www.reddit.com/r/Journalism/comments/173kfbn/going_live_from_the_street_on_a_budget/,3,3,1.0,<praw.models.comment_forest.CommentForest object at 0x17c87ba00>
309,17311lv,Pikminmania2,2023-10-08 14:51:42+00:00,"Notable website accepted an article in May, but it still hasn’t been published and now they won’t respond to my emails. Do I just stop emailing? Would’ve been a big job opportunity","Hi all,

Back in April I had a job interview for a notable travel website where I’d get a 50k salary to travel and write. A dream job for me lol. Although I didn’t get the job, the hiring manager was impressed enough to connect me with the associate editor with the intention that if I write a couple freelance articles then I could get hired full time next year.

Well, the associate editor said she liked my article, told me how much I’d be paid, but when I sent in the final draft she never responded. I waited a month or so and emailed, but she was out of office until Sept 26. However It’s now almost mid-October and still no response. It was goal of mine to work at this site so now I’m really disappointed.

Should I just move on? Would it be unprofessional to email the hiring manager instead and ask if they still are interested?

Any advice would be great. I’m still pretty new to the freelance game.",Journalism,https://www.reddit.com/r/Journalism/comments/17311lv/notable_website_accepted_an_article_in_may_but_it/,26,22,0.96,<praw.models.comment_forest.CommentForest object at 0x17c8804c0>
310,1733zi7,vedhavet,2023-10-08 16:54:47+00:00,"In the AI Age, The New York Times Wants Reporters to Tell Readers Who They Are","The paper is rolling out enhanced bios as ""part of our larger mission to be more transparent,"" says the Times’ Edmund Lee, and ""as generative AI begins to creep into the media landscape.""",Journalism,https://www.vanityfair.com/news/2023/09/new-york-times-bios?utm_source=substack&utm_medium=email,4,14,1.0,<praw.models.comment_forest.CommentForest object at 0x17c8937c0>
311,1730vrr,Sad-Friendship1841,2023-10-08 14:44:51+00:00,"Getting into legacy publications (NYT, WSJ, WaPo etc)","I'm a freelance journalist currently working with a local independent publication. I know I need more bylines and experience before even working at these big name pubs but I'm wondering if getting a master's in journalism has jumpstarted anyone's career in this sort of way?

More specifically, if the goal is reporting at a legacy publication such as NYT, will getting a master's at a school like Columbia or even a CUNY help? I plan to be in the New York market soon anyway. I know many people say a master's in this field is useless but I feel unconfident in my skills currently, and I feel like the connections out of grad school may help.",Journalism,https://www.reddit.com/r/Journalism/comments/1730vrr/getting_into_legacy_publications_nyt_wsj_wapo_etc/,25,10,1.0,<praw.models.comment_forest.CommentForest object at 0x17c893f70>
312,1731esr,TokoFuwakaa,2023-10-08 15:06:12+00:00,"I’m a gcse student, I love writing and learning, specifically about politics but many things interest me, and spreading information, but I’m concerned with what I’ve heard about the career journalism.","I’ve heard a lot about how long the hours are and how the pay is bad. I don’t particularly mind the idea of living on a not particularly high paying wage, as long as i enjoy my job. So my questions is- is it worth it? Or do the circumstances make it unlikeable?
Please be honest and don’t sugarcoat anything
Thank you",Journalism,https://www.reddit.com/r/Journalism/comments/1731esr/im_a_gcse_student_i_love_writing_and_learning/,14,8,1.0,<praw.models.comment_forest.CommentForest object at 0x17c893eb0>
313,1732pqx,Dorindon,2023-10-08 16:00:34+00:00,"could you recommend references on so called ""New Journalism"" that arose in the 1960s that arose in the 1960s and is s about telling true stories using fictional technique","I am curious to better understand what is meant by  *telling true stories using fictional technique*

A quote from the book I am reading The Storytelling Animal: How Stories Make Us Human by Jonathan Gottschall

*New Journalism that arose in the 1960s—which has strongly influenced nonfiction across genres—was about telling true stories using fictional technique*

thanks in advance for your time and help

&#x200B;",Journalism,https://www.reddit.com/r/Journalism/comments/1732pqx/could_you_recommend_references_on_so_called_new/,18,5,0.86,<praw.models.comment_forest.CommentForest object at 0x17c8ad3d0>
314,173d9mi,guysamus182,2023-10-08 23:29:56+00:00,First full time role advice/tips,"Hi everyone,

I am potentially going full time next year after working part time with a hyper local monthly paper.

I’ll be the only full time journalist (there are 3 part timers also), and will be working across 3 different monthly magazines in my area.

While I am talking to my boss today about the role, I was wondering if there was any advice on starting a full time role? 

For example, I have always worked in labour type jobs where I have 8-10 jobs to do and my day is usually mapped out. I’ll be working from home for this job and I am confused as to how I’ll know what an 8 hour day will look like - is x not enough stories for y hours etc.

Working part time (also had a full time job and studied part time) I usually did 2-3 stories a week. 

I’m very nervous to start as I’m out of my comfort zone and I guess I’m doubting myself, I don’t know.

Any tips or advice for making my days manageable and to have a decent workflow would be appreciated.

Thanks!",Journalism,https://www.reddit.com/r/Journalism/comments/173d9mi/first_full_time_role_advicetips/,2,1,1.0,<praw.models.comment_forest.CommentForest object at 0x17c8b8e80>
315,1736kke,aaronetc,2023-10-08 18:43:58+00:00,How do you abbreviate third-party officeholders in AP style?,"I'm trying to figure out if a reference to former Representative Justin Amash, who changed his party affiliation from Republican to Libertarian in 2020, should be L-Mich. or I-Mich. after he switched parties. The AP Stylebook is silent on this as far as I can tell. A quick search finds more pieces using L than using I, but none of them look like they're necessary using AP style. Any thoughts?",Journalism,https://www.reddit.com/r/Journalism/comments/1736kke/how_do_you_abbreviate_thirdparty_officeholders_in/,6,2,1.0,<praw.models.comment_forest.CommentForest object at 0x17c8ba280>
316,172kfq9,Internsh1p,2023-10-07 23:40:48+00:00,How do people fall into working for state media?,"With how polarized the media landscape has become, I'm interested in figuring out how people fall into working with state-backed media outlets.. particularly foreigners. When I say ""state media"" here, I'm not so much thinking your average publicc media outlet but rather, places like CGTN, Azeri TV< Russian media, etc. Places which you'd rarely if ever find a Western media professional.. yet there they are, often being formerly employed by the likes of BBC or another major Western outlet.

How do they fall into these things? Is it all willful grifting?",Journalism,https://www.reddit.com/r/Journalism/comments/172kfq9/how_do_people_fall_into_working_for_state_media/,20,12,0.8,<praw.models.comment_forest.CommentForest object at 0x17c8babe0>
317,172jjo5,Weird-Ad-2950,2023-10-07 23:00:11+00:00,Advice: future journalism undergrad wanting to tell a story of an amazing 78 year old man,"I have a nephew who is part of a small men’s group. They are all very different in age and culture. One of them is a fascinating elderly gentlemen who has lived an incredible life. My nephew and the others are inspired to tell his life story. 

He has a handful of written journals, emails, voice recordings etc. 

This man is willing and excited to do this as well. They wanted to start doing a podcast style interview and record as much as possible and then get all the text/recordings and create a story from there. 

Any suggestions/resources on where to start and how to organize this? 

My nephew is feeling overwhelmed. Thanks!",Journalism,https://www.reddit.com/r/Journalism/comments/172jjo5/advice_future_journalism_undergrad_wanting_to/,6,7,0.89,<praw.models.comment_forest.CommentForest object at 0x17c8cc5b0>
318,172ixti,One-Access2535,2023-10-07 22:33:56+00:00,"If you're hiring a journalist to develop a limited podcast series, what's fair pay and what major factors affect it?","I've been podcasting for years and earn the majority of my income that way. I regularly do \~10 episode limited series on specific topics, anywhere from psychedelics to Germany after 1989 to gen z's geographic mobility. 

I'd like to produce more of these, but I'm only one human, and I don't have the footprint in journalism that I feel I'd need to explore some of the topics I'd like to do in more depth, particularly in-depth current event focused stuff. As such, I'd like to hire a journalist to do the research, interviewing, and recording for them. 

The thing is that I'm not sure what this kind of work is worth. I can give parameters (# of episodes, length of episode, content features, etc.) and from that kind of guesstimate how many hours of work it would take to produce the series, but I'm not sure what hourly wage it should work out to. Typically unless they're employees the pay is by the episode, but I've literally seen anywhere from $20/episode to $5,000/episode with no universally agreed upon standard range. 

With that said, I'm wondering what people here think would be a fair rate to offer for a 10-episode, 30-minute/episode investigative deep-dive series, just so that I can get some very rough numbers. How much would someone need to pay you to produce this (5 hours of audio content)? ",Journalism,https://www.reddit.com/r/Journalism/comments/172ixti/if_youre_hiring_a_journalist_to_develop_a_limited/,2,5,0.78,<praw.models.comment_forest.CommentForest object at 0x17c8cc7c0>
