,id,author,created,title,content,subreddit,url,num_comments,score,upvote_ratio,comments
443,16ty5yg,Straight_Leading_199,2023-09-27 22:24:43+00:00,Should I attend the fall national collegiate media convention?,I got accepted to attend the national collegiate media convention in Atlanta in October and am debating whether I should attend or not. Can anyone that’s been speak to what it’s like and whether it’s worth It? What are the people that attend like and was the experience worth it? I want to go but have heard from several people that’s it’s typically a bit boring and not really worth it from a networking angle. Part of my hesitation (embarrassingly enough) is that It happens to fall on Halloween weekend. I know that’s trivial and am aware of how stupid that reasoning is but unless this is like a huge/career making opportunity I don’t know whether It would be worth missing the weekend and several days of school.,Journalism,https://www.reddit.com/r/Journalism/comments/16ty5yg/should_i_attend_the_fall_national_collegiate/,2,1,1.0,<praw.models.comment_forest.CommentForest object at 0x17cc5dc10>
444,16tkv1m,gonegongone,2023-09-27 13:37:14+00:00,Not signing noncompete?,"Been on the job at a new nexstar station for a few weeks, just got asked to sign a noncompete. Previously negotiated pay/raise amount, but noncompete wasn't a part of that conversation. Anyone have experience negotiating higher pay after being asked to sign a noncompete? How'd it go?",Journalism,https://www.reddit.com/r/Journalism/comments/16tkv1m/not_signing_noncompete/,2,3,1.0,<praw.models.comment_forest.CommentForest object at 0x17cc5deb0>
445,16tbu0i,LES_express,2023-09-27 05:23:49+00:00,What is the best time to visit a restaurant to speak to the owner or employees as a local journalist?,"Not looking to conduct an interview, more so trying to introduce myself and my outlet to local business owners to exchange contact and get more grassroots information. 

I can only imagine something like 4 pm would be a good time for a regular breakfast-to-dinner type of place because it would be empty, but I'm wary about showing up too early (before or right when they open) or too late (when they are empty but about to close and want to head home).

Thanks for any insight!",Journalism,https://www.reddit.com/r/Journalism/comments/16tbu0i/what_is_the_best_time_to_visit_a_restaurant_to/,12,13,0.89,<praw.models.comment_forest.CommentForest object at 0x17cc5f370>
446,16tpkmg,AngelaMotorman,2023-09-27 16:45:09+00:00,"Agenda Watch: Shining a bright light on local government meetings, agendas and documents",,Journalism,"https://www.editorandpublisher.com/stories/agenda-watch-shining-a-bright-light-on-local-government-meetings-agendas-and-documents,245854",0,1,1.0,<praw.models.comment_forest.CommentForest object at 0x17cc6a340>
447,16ti6qs,CovertCloudberry,2023-09-27 11:37:32+00:00,Advice on photography for news organisations,"Hey everyone - I was wondering if anyone had any advice or experience regarding getting into photography for news organisations (i.e., photographing for articles or general coverage)? As I understand, working solely as a photographer is becoming increasingly rare, with news organisations preferring to combine photography with other aspects (e.g., writing and/or video) to save money. That being said, I'm willing and able to write relatively well, so I am open to doing that in addition to photography.

Is working solely as a photographer viable anymore, and is moving to a particular hotspot and freelancing (and pitching photos to various outlets) the only way to accomplish this these days? Or is it possible to join a news organisation and then travel to specific regions?

Any help would be greatly appreciated!",Journalism,https://www.reddit.com/r/Journalism/comments/16ti6qs/advice_on_photography_for_news_organisations/,1,0,0.5,<praw.models.comment_forest.CommentForest object at 0x17cc6a400>
448,16tbngn,simp2D,2023-09-27 05:14:36+00:00,Is it a good time to pursue Master's in Mass communication in UK as an immigrant?,"s it a good time to pursue Master's in Mass communication in UK as an immigran from Asia? I am planning to take student loans and pursue my Master's in Mass communication and I have been told that as soon as my Master's is completed I can get hired in companies through my college. is this information true? I've done my bachelor's of arts  in Journalism, Psychology and English Literature and out of 10 I've scored 8.83 GPA. And if UK isn't a good option for immigrants currently then which countries do you prefer for this field?",Journalism,https://www.reddit.com/r/Journalism/comments/16tbngn/is_it_a_good_time_to_pursue_masters_in_mass/,3,2,1.0,<praw.models.comment_forest.CommentForest object at 0x17cc6a5b0>
449,16szejz,AngelaMotorman,2023-09-26 20:43:48+00:00,"What is news, anyway? Readers’ answers depend on how much they see people like themselves in the story",,Journalism,https://www.niemanlab.org/2023/09/what-is-news-anyway-readers-answers-depend-on-how-much-they-see-people-like-themselves-in-the-story/,0,5,0.86,<praw.models.comment_forest.CommentForest object at 0x17cc6aeb0>
450,16svgju,dect60,2023-09-26 18:16:10+00:00,"Musk’s Twitter Is Biggest Outlet of Russia Disinformation, EU Says",,Journalism,https://www.bloomberg.com/news/articles/2023-09-26/eu-faults-musk-s-x-in-fight-against-russia-s-war-of-ideas,0,7,0.82,<praw.models.comment_forest.CommentForest object at 0x17cc6af70>
451,16t6pe8,SpotTheNinja,2023-09-27 01:26:50+00:00,Help! Looking for a highly interactive data journalism/viz piece/website but can't find it,"I remember there was a data journalism piece that was highly interactive, where each ""webpage"" was an interactive visualization itself. It felt like a museum exhibit. I forget what the data was though or what it even was about. I just remember it did have very clean blocks similar to 538's gun death's piece: [https://fivethirtyeight.com/features/gun-deaths/](https://fivethirtyeight.com/features/gun-deaths/), but on a highly visual and interactive level. Anyone have any idea what it could be?",Journalism,https://www.reddit.com/r/Journalism/comments/16t6pe8/help_looking_for_a_highly_interactive_data/,2,1,0.67,<praw.models.comment_forest.CommentForest object at 0x17cc6ad30>
452,16t6jat,blindjournothrowaway,2023-09-27 01:19:44+00:00,How can I get my foot back into journalism?,"I recently got laid off at my day job, and am struggling to find other employment. I live in Washington DC, and have prior experience covering entertainment news in Asia (largely, Korea and China). I've applied to several jobs at major news orgs like CNN, Fox, Vox, and I think there was an application to Protocol in there somewhere. 

The 30,000 ft view is as follows:

I am blind, and I graduated with a degree in Political Science during the pandemic in 2020, I had few options so I started a Youtube channel to show my creative/research abilities. In 2021/22, I got brought on to an internship with a media company based in East Asia, where I researched and produced several articles, including a feature piece. Six months ago, I moved to DC to start my first big corporate job, and I get laid off.. I have about 2 months' of rent saved up, and Youtube is nowhere near paying the bills. 

Are there volunteering opportunities I should be taking advantage of? There isn't a particular beat I'd prefer to cover right now, as much as just getting my feet back in the door on this profession.  I'm hungry to chase down leads and speak to people, and not have to worry about rent payments (as much)... Most of my expertise lies in China, Korea, and Central Europe (broadly).. I am not sure how to sell this to an American media outlet. My beat, if you could call it that, was entertainment journalism and tech. There are a few stories I have rattling around in my brain I want to interview people about, but A)I don't know if others would find them compelling and B) Freelancing, especially in/around Washington DC, feels like a fools' errand unless you have a rich family. I can write, I can research, I can produce audio content.. but I need to figure out some way to sell that to people. Would non-major outlets even take on a half blind writer **and** pay me enough to put food on the table?

I am only asking half-jokingly - is this why people become grifters for one cause or another? They need to pay rent, or they fall down some rabbit hole?..",Journalism,https://www.reddit.com/r/Journalism/comments/16t6jat/how_can_i_get_my_foot_back_into_journalism/,1,1,1.0,<praw.models.comment_forest.CommentForest object at 0x17cc6f250>
453,16t302a,Gunshik,2023-09-26 22:54:58+00:00,Advice on becoming a freelance sports journalist,"So I’m trying to break into sports journalism as a hobby or if I’m lucky a career change.  I have a full time job that pays me well, but Im seeing how to break into sports journalism thanks",Journalism,https://www.reddit.com/r/Journalism/comments/16t302a/advice_on_becoming_a_freelance_sports_journalist/,5,1,1.0,<praw.models.comment_forest.CommentForest object at 0x17cc6f1c0>
454,16svx4d,dect60,2023-09-26 18:33:26+00:00,Inside Iran's influence operation,,Journalism,https://www.semafor.com/article/09/25/2023/inside-irans-influence-operation,1,2,1.0,<praw.models.comment_forest.CommentForest object at 0x17cc6fdf0>
455,16snszd,PopCultureNerd,2023-09-26 13:20:11+00:00,Why was a student newspaper adviser dismissed at Ashland?,,Journalism,https://www.insidehighered.com/news/students/free-speech/2023/09/26/why-was-student-newspaper-adviser-dismissed-ashland,0,4,0.84,<praw.models.comment_forest.CommentForest object at 0x17cc74280>
456,16szccr,Specialist_Good2639,2023-09-26 20:41:27+00:00,So I got a job offer today...,"I currently work at the assignment desk at a Fox affiliate station in a decent media market size (I'll say between number 32 to 41). Today I was offered a position to be a reporter at the largest newspaper in the whole state, but the pay was only a little more than what I'm making now.

I am currently going for a promotion at my current job to be a web producer, but I'm not sure where I stand now. I will follow up on this sometime this week. Multiple people are leaving the digital team at once, but even if I get promoted I'm not sure if I'll be given opportunities to grow based on my first year here.

Eventually, I want to be a field producer for entertainment and investigative stories, but I know I'll have to move to a bigger market for that in the future. I want to make sure I gain as much experience as possible before I try to move.

My question is do I just continue to stay in broadcast or do I go become a print reporter again and get out into the field? I'll have the opportunity to cover trending news, community issues, web stories, breaking news, and investigative stories if I go with the paper. I'm just worried this experience won't count when the time comes for me to go for a field producing role.

&#x200B;",Journalism,https://www.reddit.com/r/Journalism/comments/16szccr/so_i_got_a_job_offer_today/,1,1,1.0,<praw.models.comment_forest.CommentForest object at 0x17cc742e0>
457,16smmcv,Epic-rhino,2023-09-26 12:32:04+00:00,Feedback?,"Hi, I'm currently on my last year of BTEC lvl 3 and looking to do a journalism course at university next year. Therefore this year I am completely focusing on Journalism (to be specific music journalism). I have just finished my first write up on an album. I would mean a lot to me if someone could spend a short amount of time out their day to read it and give make feedback for how I can improve on it and make better pieces of writing for the next time. Thanks :) 

[https://2200880.wixsite.com/mini-project-music](https://2200880.wixsite.com/mini-project-music)",Journalism,https://www.reddit.com/r/Journalism/comments/16smmcv/feedback/,2,3,1.0,<praw.models.comment_forest.CommentForest object at 0x17cc74760>
458,16svdva,Sad_Improvement_581,2023-09-26 18:13:26+00:00,What can i do with a US journalist visa?,"Hi there - I have a US journalist visa, and wondering what are the realms of possibilities with that visa? 

As in finding a job in there, freelancing, etc..

Notworthy is I work for Major US journal, and also wondering if I need to stay with that company for his visa to stay valid? 🤔 

All input and returns of experience are very welcome!",Journalism,https://www.reddit.com/r/Journalism/comments/16svdva/what_can_i_do_with_a_us_journalist_visa/,6,1,1.0,<praw.models.comment_forest.CommentForest object at 0x17cc74a30>
459,16skm7x,Tina_from_MeetEU,2023-09-26 10:59:55+00:00,Let's talk about Press Freedom in the EU - Zoom Event with MEP Irena Joveva,,Journalism,https://i.redd.it/e3y3w5ewzkqb1.jpg,1,3,0.8,<praw.models.comment_forest.CommentForest object at 0x17cc7c2e0>
460,16saa87,NancyLouMarine,2023-09-26 01:31:54+00:00,What in the world is a flip story?,"I'm looking at a job posting for a digital content producer for a news station near me. 

One of the asks is the ability to produce 8 flip stories a day.

It also says to monitor competition that no flip stories across the DMA are missed. (which I get, if I only knew the definition of a ""flip story"" was!

I've been in print journalism for about 25 years but have never heard this term.  What the heck does this mean?",Journalism,https://www.reddit.com/r/Journalism/comments/16saa87/what_in_the_world_is_a_flip_story/,16,12,1.0,<praw.models.comment_forest.CommentForest object at 0x17cc7c7c0>
461,16sfmkk,Southern_Option5545,2023-09-26 06:02:34+00:00,advice on improving reporting skills?,"I'm a strong writer and have improved a lot recently with the news style, but I feel i've hit a block with my reporting skills. I didn't take a lot of journalism classes in college. I want to learn how to be more boots on the ground, intrepid type of reporter. I might need more specific advice then an anonymous forum but I figured I would ask here first! thanks in advance

\- Is the best way to do this to have a source network? How do I develop sources? Who is it important to establish a relationship with and chat up? should I just  start calling people involved with various issues and seeing what's up & if they've heard anything once a month? what if it's awkward

\- sometimes I get stuck trying to think of who to call about something, especially if it's in a subject I've never covered before. what's your process for that?

\- Any advice for developing a beat? I have a couple areas I cover regularly but I'm still basically waiting til stuff develops, not actually breaking anything.

\- where to find crazy shit that people want to read? 

I feel like at least half of my stories is via stuff that comes to me (tip or press release or whatever)

context: I have to write 2 bylines a day so I'm just moving around constantly to whatever's topical - I have to go with whatever story will be sure to turn by deadline. Most of the time my stories are formulaic and have already mostly been reported by other outlets, or are low hanging fruit. I use judgement the best I can for what stories I pursue but I'm not going out there, hitting the ground/calling sources of my own ideas, I am going after what is safe and comes to me, so I don't get in trouble for not meeting  quota. I would like to write more interesting stories like when I was in school and got to come up with my own ideas. we are owned by a hedge fund

I have been in my position for long enough to have gotten as comfortable as I can with the workload, but general assignment is hard. I feel like each of my 3 editors want something more civic and a bit deeper than crime stories but it's difficult to be creative and come up with multiple original, actually good story ideas a day, or even a week. I sometimes feel like also I'm overthinking it and should just stick to car crashes to save energy for other, longer pieces I'm working on in the background - is that the strategy?

\- is it possible to do this kind of journalism with my working conditions? should I stop stressing and embrace the press releases? Any advice on time management, or how to stay afloat without burnout and working extra hours? for those in similar positions, any general advice? ",Journalism,https://www.reddit.com/r/Journalism/comments/16sfmkk/advice_on_improving_reporting_skills/,8,5,1.0,<praw.models.comment_forest.CommentForest object at 0x17cc88c40>
462,16suabe,Additional-Papaya711,2023-09-26 17:32:26+00:00,genuinely asking: isn't this type of headlines disingenuous?,"When you quote a source shouldn't you say ""[the quoted source] claims: x happened"" instead of ""x happened [the quoted source] claims"" ////because the second headline gives  the reader an impression that [x happened]is a reported fact not a claim,i always encounter such headlines about the current war and they always annoy me,why would you walk an extra mile to flip the headline like this if not for a bad intent?",Journalism,https://i.redd.it/eyl6usr0ymqb1.png,11,0,0.38,<praw.models.comment_forest.CommentForest object at 0x17cc89a60>
463,16s5nie,whatsyourjourney,2023-09-25 22:11:29+00:00,How do you write articles out that you technically don’t agree with?,"How do you shape your questions to those interviews in order to get good quotes? Do you think your personal beliefs affect how you’re going to ask questions towards your interviewees? 

I’m still a journalist student, so I’m not sure how it’s entirely like once I have a manager and real editor (still looking for an internship). I mean aren’t you still kind of in charge of the perspective of how you’ll write the article after you interview sources? If so, then how do you write it out if you may not agree to the subjects belief/standpoint?

These questions probably don’t make sense without an example, but I really just mean in future reference when I want to report on sensitive subjects like say…write about how many women support abortion nowadays in different countries and the data reports, but I may not agree to abortion (this isn’t necessarily true, just an example). 

How do I keep my bias away I guess in other words, especially when asking questions on stuff like this during interviews (most critical part I feel makes the article)?",Journalism,https://www.reddit.com/r/Journalism/comments/16s5nie/how_do_you_write_articles_out_that_you/,18,6,0.72,<praw.models.comment_forest.CommentForest object at 0x17cc96820>
464,16scv82,Successful-Hold9001,2023-09-26 03:33:25+00:00,Hey guys! I’m a student and covered a story about an a cappella group I’m in if you want to check it out and give feedback!,,Journalism,https://youtu.be/yWlUTbPyqcY?si=XqINgs2wH0UEXXHH,1,1,1.0,<praw.models.comment_forest.CommentForest object at 0x17cc96970>
465,16rsinn,dect60,2023-09-25 13:44:07+00:00,"Iranian security officers hold guns to heads of Isobel Yeung & VICE News team, confiscate belongings & delete footage. Crew in Iran to report aftermath of Mahsa Amini's death",,Journalism,https://twitter.com/CFWIJ/status/1703005808198312112,0,6,0.88,<praw.models.comment_forest.CommentForest object at 0x17cca2340>
466,16rtguc,burtzev,2023-09-25 14:21:48+00:00,Atlanta Cop City Indictments Threaten Press Freedom Too,,Journalism,https://theintercept.com/2023/09/11/cop-city-indictments-protest-press-freedom/,0,3,0.81,<praw.models.comment_forest.CommentForest object at 0x17cca2700>
467,16r5ntr,tamsinrm,2023-09-24 18:59:39+00:00,Job opening in California,"I’m an editor for a digital local news startup going into its fourth year. We have a job opening for an experienced hire (mid-career or above). It’s a brand new role. In-office role in Santa Cruz, California and must be eligible to work in the U.S. Compensation to match the area’s high cost of living.

The ideal candidate is someone who does investigative and watchdog reporting, who ideally has a background writing about criminal justice.

We have a great team (newsroom of 10) age ranges of mid-20s to early 60s. I was a reporter at national publications (in Canada) for many years and have done some award-winning investigative and data journalism work. But as managing editor I don’t have as much time as I’d like to really work with and mentor reporters on how to do this kind of work themselves. 

So the right candidate likes to collaborate with reporters, most of whom really haven’t done much investigative reporting and need help. And they’ll also have a beat focused on criminal justice. (Shooting for an average of 2 bylines a week but there’s no set quota. Quality over quantity.)

If you fit the bill or know someone who does, [take a look here.](https://lookout.co/santacruz/job-board/story/2023-09-22/criminal-justice-investigative-correspondent-lookout-santa-cruz-hiring-job)",Journalism,https://www.reddit.com/r/Journalism/comments/16r5ntr/job_opening_in_california/,0,13,0.89,<praw.models.comment_forest.CommentForest object at 0x17cca2b20>
468,16r4znr,Shrewcifer2,2023-09-24 18:32:12+00:00,Where to start,"Where should I start to develop basic writing and journalism skills? If someone could recommend an introductory evening course in London, I would be grateful. I know that City and CiJ offer courses, but neither meets my needs this term.

I work in the health sector and I intend to maintain a real day job, but I would like to develop some writing projects on the side. Apart from just starting to wrote on Medium, I don't know where to start. I have a particular interest in public health, mental health and social equity, from a fact-based perspective rather than an ideological one. I also find investigate journalism interesting, but I am not there yet. 

Anyone have any thoughts about where I could develop basic skills? I prefer in-person courses.",Journalism,https://www.reddit.com/r/Journalism/comments/16r4znr/where_to_start/,9,3,1.0,<praw.models.comment_forest.CommentForest object at 0x17cca2a30>
469,16r9spk,barneylerten,2023-09-24 21:45:55+00:00,"How about an AI-curated website/magazine with the best, latest AI news?",,Journalism,/r/artificial/comments/16r9qs1/how_about_an_aicurated_websitemagazine_with_the/,6,0,0.33,<praw.models.comment_forest.CommentForest object at 0x17ccae3d0>
470,16pxwsb,Mrprofessorpresident,2023-09-23 07:21:14+00:00,Discussion: being a good writer vs. good reporter - what are the differences?,Someone once told that being a good writer and being a good reporter are two different things. Do you all think that’s true?,Journalism,https://www.reddit.com/r/Journalism/comments/16pxwsb/discussion_being_a_good_writer_vs_good_reporter/,28,15,0.86,<praw.models.comment_forest.CommentForest object at 0x17ccaedf0>
471,16proxp,ExeterWorld,2023-09-23 01:42:01+00:00,Did a journalist disappear in your country?,,Journalism,https://i.redd.it/5oq97k9qtwpb1.jpg,8,22,0.9,<praw.models.comment_forest.CommentForest object at 0x17ccc63a0>
472,16q1brk,Griffle98,2023-09-23 10:45:46+00:00,(UK Based) I’m starting a Journalism MA course after studying History at Undergraduate: Help!,"Hi, as the title suggests, I’m starting a journalism course soon but my background is in History. 

Having not done a 3-year journalism undergraduate course, what kind of information, books and general advice would you give to help bring me up to speed? 

Thanks!",Journalism,https://www.reddit.com/r/Journalism/comments/16q1brk/uk_based_im_starting_a_journalism_ma_course_after/,10,4,1.0,<praw.models.comment_forest.CommentForest object at 0x17cccd190>
473,16q78i3,Olaf_Is_Here,2023-09-23 15:22:35+00:00,Fastest RSS readers for Android,I am looking for a free mobile app for Android for RSS feeds that updates new articles on websites every 1 to 10 minutes. Does anyone have any suggestions?,Journalism,https://www.reddit.com/r/Journalism/comments/16q78i3/fastest_rss_readers_for_android/,1,1,1.0,<praw.models.comment_forest.CommentForest object at 0x17cccdb50>
